SequentialId,Status,StorageDate,CloseDate,Team,Closed,Tags,QueueTime,FirstResponseTime,AverageResponseTime,CustomerName,AgentName,AgentEmail,Tipo,Empresa,Apolice,Plano,QUESTÃO 1,QUESTÃO 2
5bf1f6ff-1af1-40cf-a800-96705e94c614,Closed,1971-09-19,1990-10-16,Juarez-David,Yes,['give'],24,7,7.271282744569331,Marcus Kemp,Holly Cardenas,ronald37@example.com,Type2,Mcdonald Group,37850783993,Gold,Build but north father environmental bar whom.,Agent protect show top modern.
a0fe6b54-c8b8-4e46-9a94-1fe86f4bc95c,Pending,1951-02-17,2020-03-31,"Smith, Gordon and Soto",No,"['bar', 'eye', 'society', 'lawyer', 'yes']",60,13,6.418575419637456,Ms. April Smith MD,Christopher Arias,garciaryan@example.org,Type3,Reid LLC,45148813238,Bronze,Capital movie may floor although.,Clear risk among.
c9560946-457f-4560-9349-0a7163ff0120,Open,2000-05-29,2023-10-11,Hale Inc,Yes,['less'],33,23,1.665605296176927,Angela Gonzalez,Johnny Peterson,schultztamara@example.org,Type3,Abbott LLC,38976884392,Silver,Life forget table.,Of Democrat air anyone first traditional.
50febbcd-99dd-4896-a4e1-5c4728cf2d69,Pending,1993-02-10,1998-10-22,Walker-Collier,Yes,"['few', 'enter']",42,28,3.2934475879656007,Jeanne Shaw,Linda Orozco,michael70@example.org,Type3,Clay and Sons,25570141511,Silver,Positive enter provide stay recently.,Unit federal score owner little between shake second.
fdf325ba-8061-4f4b-8b75-a3891cbe383f,Closed,1993-08-14,1995-01-10,Valdez LLC,No,"['future', 'what', 'fill', 'including']",5,9,9.797719604340573,Gregory Newman,Theresa Wilson,gainesalexis@example.org,Type2,"Ramirez, Watkins and Kane",48572636970,Bronze,Effect bank sea identify attack unit.,Lawyer care present cut police age.
352ce8ab-f1e3-4a02-82e7-929f676f73fc,Open,1969-04-06,2001-01-21,Robinson-Diaz,No,"['save', 'five', 'animal', 'media']",6,6,9.091599762429881,Jason Myers,Brett Thompson,allison68@example.net,Type3,"Turner, Rose and Fox",6192446877,Silver,Artist very audience.,Mission service against Mrs ago everybody anyone.
3bdf387f-c898-4532-89ea-83feace89e52,Closed,1955-12-27,2017-07-08,Blackburn LLC,Yes,"['little', 'task', 'only', 'get', 'measure']",25,23,5.021987996635249,Catherine Black,Stephanie Freeman,ostewart@example.com,Type2,Payne and Sons,81981508224,Silver,Firm to speak.,Whatever site friend various.
bfd7c778-e583-498d-a84c-90a0ea2e4b28,Pending,1972-05-04,1972-06-15,Hebert-Armstrong,No,"['alone', 'land', 'strong', 'sign', 'tree']",33,15,5.121839593810339,Autumn Davis,Shelby Nguyen,jzimmerman@example.com,Type1,Meadows-Francis,37657414694,Platinum,Subject return production figure both both year.,Outside share law view.
344e5018-d95c-4667-87ce-0cfa1b5ccbaf,Closed,1972-06-20,2000-11-10,Thompson-Garner,Yes,"['with', 'loss', 'success', 'decide', 'whole']",48,28,6.677500024007842,Adrian Gibson,Andrea Webster,gruiz@example.com,Type3,Armstrong PLC,42693682444,Silver,Political professional each matter develop several sign.,Lay account nothing.
23a40238-475a-49db-a4d7-dac93167768f,Pending,2003-10-17,2017-04-14,Alvarado LLC,Yes,['woman'],24,15,2.4511898668085217,Brett Miller,David Reeves,holmeschris@example.net,Type3,Church and Sons,94465237123,Gold,Recent computer action collection.,Listen fight discover involve.
155e58fa-5dbe-4441-aed4-bea936d07556,Closed,1996-09-20,2010-10-11,"Anderson, Hansen and Watson",Yes,"['ability', 'box', 'character']",32,25,4.0801576740342345,Jeffery Macdonald,Danielle Scott,aguilardonald@example.com,Type2,Kramer-Knight,81603095388,Silver,Gas the marriage remain compare.,Yeah public movement.
dd328422-aed3-4706-917e-9928a0971e84,Open,1957-04-11,2008-09-30,Maldonado-Parker,Yes,"['there', 'all', 'property', 'thought']",32,24,8.9993525621149,Christine Kirk,Steven Smith,christopher47@example.net,Type3,"Conley, Acosta and Gibson",55029855371,Gold,Under employee might event wide name.,Wide hot event opportunity college.
fb2d1c80-4a57-49d0-8f7b-eb869dfc8faf,Open,1966-02-20,2011-12-25,Gomez-Hinton,No,"['because', 'drug']",37,6,2.645961367854582,Jason Hughes,Kevin Pierce,austinhayes@example.com,Type1,Boyd PLC,67939693260,Bronze,Case daughter unit nearly grow yes.,Hospital financial especially.
9bc0b61e-f7ea-4114-86b4-32b43b4fa403,Pending,1998-07-04,2003-10-22,Morrison Ltd,No,"['young', 'represent', 'your', 'whether']",6,17,6.397181740276242,Jennifer Rodriguez,Craig Brown,stephanie14@example.org,Type2,Williams-Moody,35268961209,Platinum,Exist control let check.,And beautiful career world.
97b979df-16a8-4aae-8562-081c5debd847,Pending,1972-05-10,1993-08-07,Jones PLC,No,"['long', 'us']",5,23,2.4726314076405185,Nicole Williamson,Adam Thornton,jameslewis@example.net,Type2,"King, Miller and Mcguire",56951907381,Gold,Structure follow happy heavy.,Property least friend wonder both class card.
78ec6143-64a8-41a5-b4e4-68566d9edfda,Open,1991-02-26,2005-04-26,Shaffer PLC,No,"['who', 'pull', 'appear', 'hotel', 'me']",40,22,2.2151916310661006,Amy Little,Michael Brown,ganderson@example.com,Type2,Phillips Inc,91480245889,Gold,Side pattern material meeting.,Positive movement hand up although one usually.
f89b94a9-dcd4-4aa0-a912-992e649f658b,Pending,1982-11-02,2013-09-16,Brown Inc,Yes,"['apply', 'support', 'natural', 'behind']",4,12,6.582375082975749,Pamela Dixon,Dawn Brown,perezmarcus@example.net,Type1,Barrera-Benjamin,40202347446,Platinum,Break body test.,Safe plan make citizen wall.
b21c1847-c084-4c10-8d0b-3c52afd2ccb1,Pending,1954-05-13,1990-02-03,Vincent Inc,Yes,"['adult', 'including', 'open', 'bag', 'well']",28,5,5.700255644934279,Thomas Hernandez,Todd Sims,jason38@example.net,Type2,Brown-Montoya,32200105903,Gold,Put three specific.,Health much these factor everyone child.
982b4f4b-3338-489b-aadb-03f1be847b72,Closed,1962-10-27,1970-02-18,"Jordan, Adams and Ross",Yes,"['increase', 'toward', 'chair', 'add']",44,30,4.464619152955606,Kelly Livingston,Jeff Maynard,denise23@example.com,Type1,"Cruz, Mitchell and Christensen",16237953196,Platinum,Work everyone need across.,Author particular television measure.
b086ba04-3c6c-41af-b516-b3324f26e938,Closed,2004-11-25,2020-04-02,Jones Ltd,No,"['his', 'she', 'born']",42,26,1.9576604447431332,Autumn Brown,Cody Brown,eflores@example.org,Type1,Perez-Jones,91627541279,Bronze,Second to media too pretty future language in.,Ability fly air act product study fight.
b65e24e0-a6c1-4304-86a9-2919117c6e1c,Closed,1987-10-18,2003-02-13,"Oliver, Scott and Mason",No,"['company', 'worker', 'feeling', 'success']",56,11,5.9971563792011695,Richard Blake,Kenneth Sutton,rmitchell@example.com,Type3,"Conway, Garcia and Williams",69609340463,Gold,Office identify determine red.,Want no idea radio add.
0d6e5c20-e4ae-41c2-84e5-1e118e70f189,Closed,1953-11-25,2009-07-11,Murphy-Rush,Yes,"['stand', 'enter']",27,25,6.444647091236174,Michael Hickman,John Wilson,staffordsean@example.com,Type2,Webb and Sons,80366211497,Gold,Religious compare necessary eight size.,Create anyone half become our something rate.
a4dcf90e-e59f-4d3b-818e-a96ae042c08f,Pending,1975-10-26,1988-06-29,Jimenez-Robbins,No,"['similar', 'charge']",34,6,5.568449883860039,Jessica Sandoval,Brianna Evans,carrolldeborah@example.net,Type2,Zamora PLC,10427349744,Silver,Into policy what generation reality south smile.,Similar room indicate staff run small part.
3d95c28c-9f7b-406f-b91b-b7069ae965e7,Open,1979-08-02,1995-03-10,Willis Ltd,Yes,"['machine', 'weight', 'really']",24,6,6.031391463663577,Connor Webster,Elizabeth Weeks,ljones@example.net,Type3,Rodriguez-Long,24016234179,Gold,Marriage answer understand benefit you leg concern place.,Improve perhaps candidate can.
e0fd87f0-90b5-4f0d-9c2d-4d562376313d,Closed,1971-07-24,1980-03-11,Rogers-Blake,No,"['per', 'kitchen', 'director']",60,19,8.004342065537799,Christian Owens,Mrs. Erica Chavez,asmith@example.com,Type1,"Vasquez, Bell and Cummings",99519455482,Gold,Race learn something fall hope.,Or even light physical.
66122967-c5e1-4160-988e-604fa0403617,Closed,1952-09-02,1962-10-22,Preston-Davis,No,"['term', 'born', 'listen', 'seek']",24,23,2.692254847617182,Tyler Meyers,Kristine Ramos,hmathis@example.com,Type3,Farrell-Carroll,46468727678,Bronze,Conference culture may.,Arm president include way evidence quickly.
92329b73-dd19-4f14-8182-c8f542d0339f,Pending,1973-05-15,1976-02-19,"Smith, Hernandez and Gutierrez",No,"['design', 'investment', 'whose']",51,27,4.745737590093214,Alexandra Johnson,Sheryl Wood,tracy11@example.net,Type2,Gonzalez-Morgan,54662698956,Bronze,Trouble left space economy.,Rule around stop big scientist reason.
37d258b1-16fb-4f07-95b7-255ab7e964bc,Open,1982-06-05,2014-02-23,"Phillips, Hernandez and Morris",No,"['but', 'something', 'care', 'research']",10,9,2.5215298601957574,Michelle Gray,Matthew Stephens,tracy98@example.org,Type3,"Thomas, Mccullough and Smith",94769137496,Gold,Live not out social art better.,When particularly year but tonight research.
c5868412-b039-40da-a424-3809aa2c817f,Open,1974-10-25,2013-03-07,Rowland LLC,Yes,"['dark', 'avoid', 'role', 'experience']",54,27,4.150449596570721,Maxwell Joseph,Donald Payne,ihenry@example.com,Type3,Ward Inc,12484053220,Platinum,Field job arrive heart anyone throw poor.,Unit kind compare who.
ef30c4d5-12c0-45a4-aad8-201a976af53e,Open,2002-07-19,2019-08-27,Davis and Sons,Yes,"['contain', 'religious', 'certainly', 'tend']",39,28,9.151345941209238,Stacy Thomas,Mark Rose,michaelmorales@example.org,Type3,Hunt LLC,53205851246,Platinum,Over you amount possible tax.,And house rate quite authority report reach.
6d2d0270-a337-451f-ad8f-f842b5469327,Pending,1980-08-03,2005-06-11,Rose PLC,No,"['foreign', 'director', 'skill', 'soldier', 'use']",17,27,4.7058326251619444,Craig Guzman,Christian Kelley,curtis78@example.net,Type3,Garrett-Martin,23350905904,Gold,We always though station.,Middle often actually look according hotel.
49b33211-a635-4b8d-a933-6a1a0d6d0bfd,Open,1971-08-04,1983-09-17,"Young, King and Hawkins",Yes,"['why', 'night', 'animal', 'west', 'day']",6,8,5.795555562214081,James Perry,Molly Johnson,destinygross@example.net,Type1,Williams Inc,8663406142,Bronze,Director for know white perform throughout sense Republican.,Ok people inside small.
51526e4d-0f2a-43dc-bc25-710a707e62db,Pending,1992-12-01,2000-05-22,Ramos and Sons,No,"['value', 'argue', 'human', 'speak']",23,13,4.316443870119826,Connie Mills,Jennifer Landry,john94@example.net,Type3,"Frazier, Frazier and Preston",24699235133,Platinum,Kind purpose fund win.,Add their wall parent east marriage.
abc924be-f744-4536-847b-242483679ef0,Open,1960-07-18,2014-08-23,"Myers, Simmons and Howard",Yes,"['each', 'well', 'sea']",33,29,8.03300184159897,Curtis Mueller,Raymond Durham,kgarcia@example.net,Type3,Smith-Owen,91906188475,Gold,Ready step something nation however.,Establish stuff choose.
555c67ba-e20d-49a4-9e1b-4221420c4927,Closed,1994-11-04,2019-12-02,Dawson-Glover,Yes,['church'],24,18,1.013589456260154,William Davis,Dr. Ian Reed Jr.,derekclark@example.com,Type1,"Jackson, Johnson and Hale",45054694830,Platinum,Firm act relationship director rule color.,Pretty better by together cost along half make.
06117e02-9cba-4c2e-a926-22be2fdd8979,Pending,1979-12-02,2013-04-13,"Powell, Wagner and Mora",No,"['yes', 'soon', 'up', 'various', 'cause']",33,6,9.275187332731008,Timothy Scott,Charles Mahoney,watkinssarah@example.com,Type1,Taylor-Rogers,90147936188,Gold,Generation should term and step benefit.,Best glass any hear.
ccc97730-0010-47f1-b429-0ee7f96fccff,Pending,1963-03-14,2019-04-24,"Hubbard, Cox and Johnson",Yes,"['baby', 'rich', 'idea']",46,5,2.185725824496392,Holly Montgomery,Laura Washington,keith02@example.net,Type1,Villa Group,10136153484,Silver,Reduce hand politics participant accept really.,Office food receive mouth first beyond.
8c25bfe7-012c-4ddb-a71f-e2b27d874fdd,Pending,1982-04-07,2015-10-10,"Bradshaw, Baker and Miller",Yes,"['remain', 'military', 'design', 'want', 'rich']",9,20,4.820521108196502,Eric Jones,Andre Johnson,brownwilliam@example.org,Type3,"Williams, Mullen and Bennett",79935876094,Gold,Race he along.,Employee nor industry senior.
eb8c9fc8-a769-43f8-ad2f-dbe458224b3f,Closed,1951-12-16,2018-08-14,"Hernandez, Turner and Mcguire",Yes,"['threat', 'enter', 'past']",38,27,4.904443887549786,Tony Shaw,Lisa Giles,jhale@example.org,Type2,Sherman Inc,671224291,Bronze,Experience window each fly season foot.,Whole wall young beautiful big successful option.
cf28e95f-f059-48c0-bd38-07e1a2fbfa55,Open,1988-07-14,2020-12-28,Trujillo PLC,Yes,"['wall', 'culture', 'left', 'treat']",47,24,7.2561375832639445,Peter Phillips,Jennifer Castro,suarezkristen@example.com,Type2,"Hicks, Williams and White",33546795264,Platinum,Would grow actually so staff painting.,Film range increase argue service vote nothing.
eb765f2c-f8cd-43af-96bc-3d59e442ccfa,Pending,1994-07-19,2003-01-02,"Wood, Carson and Flores",No,['attorney'],51,15,4.15090314051128,Carmen Bishop,Timothy Smith,patty44@example.com,Type1,"Smith, Walls and Washington",99098889905,Gold,Occur as establish much.,Blood Democrat box different skill.
280625a7-c266-4fe0-8f78-4fa85c0191c0,Open,1962-11-03,2017-01-06,"Parker, Lewis and Griffin",Yes,['child'],24,27,5.619145631130512,Christine Smith,Justin Simmons,hernandezjennifer@example.net,Type2,Garcia-Murray,79488882457,Silver,Kind task important carry hear sister.,Service note international method more guy across capital.
013c40c8-f411-4157-a249-f97b4fae310a,Open,1998-11-28,2021-03-21,Hudson and Sons,Yes,"['opportunity', 'food', 'blood']",10,24,9.48943202374645,Andrea Davis,Pamela Lane,jimmyaustin@example.com,Type3,Smith-Strickland,10491620652,Bronze,Which author word chance sea company.,New network wish around too rich performance.
3ec15faf-10c0-4c4f-a69a-822413c8b2f3,Closed,1954-02-16,2013-11-17,Johnson PLC,Yes,"['central', 'believe', 'science']",15,13,8.914437854349433,Eileen Norris,Mary Campbell,thomasanthony@example.net,Type2,Wilson Inc,45512908820,Silver,Page industry everyone everyone simple win.,Could health director measure goal summer add.
62ea4282-9abd-4425-ae71-73765b7cb839,Closed,1962-04-23,1969-11-15,"Wong, Reynolds and Washington",No,"['out', 'more', 'partner']",32,10,5.25055873201701,Brian Gonzales,David Stephens,michaelvelez@example.org,Type1,Harrison Ltd,54267698345,Bronze,Involve small state unit.,Check peace near letter yourself simply dog.
959dbaf5-849d-4126-8f02-6128b61cfd2a,Pending,1959-07-11,1978-02-02,"Morgan, Brock and Lara",Yes,"['form', 'cause', 'week', 'church', 'trial']",44,21,6.990870597462461,Michael Rivera,Anthony Potter,rebecca53@example.com,Type3,Guerrero and Sons,93742129839,Bronze,Federal yes source at.,Sit activity cold.
169ea6aa-fb46-4a0f-acd2-52a8aa699974,Closed,1985-09-20,1988-09-16,"Schmidt, Thomas and Hamilton",Yes,"['east', 'management', 'firm']",7,6,8.430225416382449,Alexander Collins,Matthew Thompson,morrowjohn@example.com,Type1,Robinson-Nichols,73113610360,Platinum,Majority many class hotel institution successful news more.,Culture fish news now.
676ab490-06e9-4ac2-9352-57c6fff723d2,Open,1981-11-16,1987-11-28,"Murray, Baker and Thomas",No,"['sport', 'guy', 'floor', 'next', 'respond']",43,6,8.577014257568443,Paul Brown,Edward Dougherty,anthonysmith@example.net,Type1,Gill Group,2693854022,Bronze,Series daughter much cultural understand oil.,Join commercial receive apply see.
2ac782ac-b6b1-45e8-9755-144b8bb79743,Closed,1975-11-10,2007-10-18,"Wilkerson, Holt and Peterson",Yes,"['I', 'whole']",27,21,9.003990717893705,Regina Phillips,Denise Little,qashley@example.net,Type2,Quinn-Stewart,48633018612,Gold,Store its eight wife we.,Leader account against dinner report say large.
7eba4cf8-c806-4577-b60e-fa54367917c4,Pending,2005-02-10,2014-02-27,Washington-Burton,Yes,"['look', 'choose', 'defense', 'very']",17,22,8.462000973359196,Joseph Howard,Heather Miller,brownalexandra@example.net,Type3,"Cabrera, West and Alvarado",54973174118,Gold,Truth lay hot article speech.,Behind real remain often true.
fe712016-6450-421d-8a11-f60bade27b86,Open,1959-10-10,1975-06-23,Morrison Group,No,"['sing', 'interesting', 'number', 'simple']",37,21,3.1037359703582976,Jeremiah Hall,Michael Stephenson,lorettarivera@example.org,Type1,Gutierrez-Thompson,57790409176,Gold,Miss boy television want kid build.,Financial even station political.
dbc4dbad-03ec-4b7e-a939-c1942c6cd3a2,Closed,1948-12-02,1956-09-23,"Chapman, Hamilton and Baldwin",No,"['too', 'them', 'ok', 'language', 'town']",12,10,9.423783763932416,Alexander Brown,Brandon Thompson,qcook@example.net,Type2,Sawyer-Kim,64198566813,Silver,Serious treatment from leg end.,Investment set majority suddenly seat place.
00a95847-e11f-40d9-a0a2-7dcfc1a46d81,Pending,1963-01-17,1971-05-02,Scott-Edwards,No,"['white', 'speak', 'some', 'although']",24,26,6.032741496272505,Erika Richardson,Jeffrey Bradley,dgillespie@example.org,Type3,Klein PLC,449114613,Gold,Among another say discuss.,Industry center throughout.
67922d84-9212-4ad1-ada0-e1a04e17704a,Pending,1964-09-09,1965-02-06,"Short, Garcia and Donovan",No,"['TV', 'enter']",33,6,7.314843059182666,Anne Case,Mary Foster,calvinmurphy@example.com,Type2,"Santana, Reed and Newman",86339749052,Silver,Nature animal choice teacher.,Movement north people century however.
b474123c-d2af-4929-99a5-34b2628acb43,Closed,1971-10-27,2003-06-29,Snow Ltd,No,"['plant', 'time', 'soldier', 'entire']",22,8,3.9522636518311876,Janet Johnson,Keith Moore,turnersusan@example.net,Type3,Reeves-Wade,78866228289,Bronze,House television actually evidence point.,Lot pattern audience wife team serious.
d3e197fe-e607-4fac-a5e4-b377b777392a,Open,1990-02-05,2020-07-28,Calderon PLC,Yes,['rest'],10,9,3.979650068440549,Amy Mack,Lynn Berry,danajohnson@example.org,Type3,"Stanley, Bautista and Wilkins",93740603255,Silver,Science above drive perhaps eye know.,Which increase girl.
667e9546-a17f-4448-a831-7fceb6ae526e,Open,1949-05-13,2000-12-03,Flores LLC,No,"['lawyer', 'officer', 'your', 'far']",18,8,5.00279271092889,Jennifer Livingston,John Rose,nancy95@example.com,Type2,Adams Inc,71636340616,Gold,Happen first never money only recently.,Already property game him administration particularly.
28eabac5-e218-4f56-8588-708345e9394e,Pending,1968-08-29,1989-12-07,Strickland and Sons,No,"['series', 'size', 'positive']",35,6,2.4722884756242225,Kathy King,Steven Ford,judithboyer@example.com,Type3,"Lucas, Fox and Sanders",47777951915,Silver,Wonder participant view beyond analysis physical generation important.,Contain environmental you letter way.
032410e2-c97c-43c9-9a60-f611fa7d338d,Pending,1956-05-29,1961-05-15,Howard-Robles,Yes,"['must', 'live', 'this', 'kid', 'talk']",42,12,4.252870399682609,Nicole Jensen,Robert Rodriguez,longsherry@example.org,Type3,"Stevens, Warren and Miller",98380085088,Platinum,Share enter first vote turn save.,Choose system time still.
8017db5c-7dfe-43de-867f-9c238399071f,Pending,2004-01-20,2015-01-26,Contreras-Davidson,Yes,"['choice', 'your', 'beyond']",55,10,7.22348939812307,John Ross,Chelsea Solis,kaitlynfoster@example.net,Type2,Elliott-Jensen,74279616247,Gold,Television board finally buy way mission authority.,Keep system culture own.
01a152df-845f-4be7-89f0-1e35aabd7d5f,Pending,1973-03-22,2006-05-27,"Thomas, Young and Hawkins",Yes,"['threat', 'maintain', 'general', 'wrong', 'sense']",23,23,6.541787265869175,Trevor Mitchell,David Montgomery,bbarrera@example.com,Type2,"Smith, Richardson and Braun",92756426056,Gold,Open ahead throw sign we same.,Have spend left activity.
2d0a24ff-6dd2-4498-bae5-7dac33b19da4,Closed,2003-12-25,2005-02-22,"Jackson, Lopez and Monroe",Yes,"['suddenly', 'mouth', 'involve', 'head']",30,18,9.306467972084416,Danny Clements,Jason Washington,ronnie26@example.net,Type1,Owen-Mack,59665015497,Gold,Important especially lead recently point site race authority.,Again south issue better our challenge figure former.
a2cd8e3f-b113-4f24-ba4f-87b8ceec6b9e,Pending,1962-10-20,1964-05-24,"Ballard, Quinn and Turner",Yes,"['difference', 'region']",54,15,3.79510426709793,Samantha Holland,Greg Robinson,daviskristina@example.com,Type1,Byrd Inc,39172100164,Gold,Reality think back operation view these since someone.,Sense fly career read.
39c314ff-ccc5-4c9a-ada0-fc1e55070fdf,Pending,1987-04-12,2005-05-19,"Lee, Aguirre and Molina",Yes,"['third', 'price', 'part']",30,7,4.674186926201119,Shawn Arellano,Teresa Green,xharrison@example.net,Type1,Jones-Vasquez,27194692338,Silver,Next now next really stage visit science.,Memory view safe anyone.
f40614e8-8540-402a-aab5-c9d08f4ef806,Closed,1975-04-19,1998-12-25,Martinez-Colon,No,"['sign', 'against', 'six']",59,23,2.4625245527667796,Megan Coleman,Charles Jackson,bentleydenise@example.org,Type3,Jones-Valdez,49004970369,Platinum,Return kitchen successful represent.,Act off spend open.
906887ac-23c2-4e50-8004-084ba72ebb56,Pending,1958-07-08,1972-10-04,Brewer Inc,No,['magazine'],9,20,4.753808677601563,Kyle Garcia,William Love,barry07@example.com,Type3,Bowen Inc,72441280758,Gold,Year school field up.,Dog why similar three wish imagine chance lawyer.
b8e73ad8-5484-4427-b976-652ae0d0a123,Pending,1989-07-14,2015-11-09,Medina-Huber,No,"['fire', 'student', 'simply', 'training', 'hour']",55,25,2.2437401479930004,Joel Butler,Mrs. Dana Ramirez DDS,meadowsjulie@example.net,Type1,"Brown, Bradley and Ruiz",50721863202,Gold,Notice the prevent pass six relationship decide.,Voice concern in memory early onto mouth.
588c6f1b-e8e0-416e-9bad-456f845840a7,Pending,1990-03-28,2021-07-24,Wyatt PLC,No,"['art', 'service']",30,13,3.608778332086337,Austin Gilmore,Alexis Sanchez,lunaelizabeth@example.org,Type2,"Whitehead, Tyler and Evans",42429531173,Bronze,Summer power that wonder he thus take investment.,Move summer party beat agree difference both pressure.
cf345a1e-c9f4-494f-809d-865e98be0f80,Pending,1968-09-20,1971-06-22,"Long, Davis and Wiggins",Yes,['work'],38,21,6.144904276264004,Jennifer Gardner,Monica Bradford,gomezjody@example.com,Type2,"Macdonald, Galvan and Cook",17248185664,Bronze,Agree majority window fact mind Congress bill.,Cup southern center financial whom.
77e997c6-9aac-497e-9b56-4e9be1ddaf6d,Pending,1954-09-28,2007-02-01,Hurley Group,No,['behavior'],9,21,9.721905232292828,Meghan Freeman,Steven Walters,maxwelljonathan@example.com,Type3,Duncan Ltd,32431393704,Gold,Force pull show several allow.,Doctor bill protect hundred be up.
2fedf5c6-2f44-41b2-8dfc-87cf8f5546ea,Open,1955-08-28,1964-07-27,Johnson Group,Yes,"['tonight', 'work', 'thought', 'worry', 'cover']",2,21,8.679268935629354,Erika Butler,Daniel Crawford,campbelljoseph@example.net,Type3,Jimenez-Brooks,87358316100,Bronze,Woman decade conference amount bed he security thank.,Speak spend during focus say station house.
1e700fea-2734-4e38-a8e4-0ccbdbe8b9ac,Open,1995-11-26,1999-06-22,Mathews-Hall,Yes,"['approach', 'hair', 'admit', 'become']",48,20,8.060270262736488,Joseph Taylor,Nichole Walters,hebertmichelle@example.org,Type3,Adkins Ltd,37213079768,Platinum,Fly away explain more.,Similar bank strong site believe for break.
9fe7af58-bf5c-4313-9703-72ce84d4d0ec,Open,1967-03-13,2002-10-16,"Cruz, Gilmore and Williams",Yes,['some'],39,8,7.545897054896933,Renee Mejia,Laura Burton,robbinsandrew@example.net,Type2,"Rodriguez, Jenkins and Williams",71336548955,Platinum,Others assume reality.,You fear doctor difference clearly spring ok.
53e52fa3-5848-473e-b5b7-c56e7ddb94b2,Closed,1960-06-21,1993-04-22,Sutton-Moore,Yes,['everything'],16,13,2.776523474970742,Jonathan Richardson,Sandra Brown,fwatts@example.net,Type2,Valdez and Sons,76503799634,Platinum,Matter explain spend scientist night much.,Would glass early top remember analysis.
261c7684-4d98-44fb-9d04-995a61ebb52c,Pending,1958-07-19,1973-12-01,"Smith, Clay and Ortiz",No,"['discussion', 'standard', 'politics', 'program', 'knowledge']",48,9,1.2617097069789813,Richard Farrell,Nicholas Howell,millerzachary@example.com,Type3,"Williams, Rogers and Hicks",50270516548,Silver,Public capital serious population leg support bank.,Buy team success take.
2c0be19b-531e-4e9c-8603-27570740e74b,Open,1993-11-08,2015-08-01,Rodriguez-Walker,No,"['heavy', 'grow', 'both', 'director', 'somebody']",44,11,2.8145313870641244,Daniel Brown,Daisy Lawson,colepratt@example.org,Type2,Meyer-Hancock,72232886226,Bronze,North trade spend surface only many.,Policy fall assume tell yet mean fast.
788e6752-fa2b-4efd-91a9-c0ada5a6a7b0,Open,1999-06-11,2021-06-02,Jordan-Nunez,No,"['home', 'under', 'local']",15,19,7.07109915165939,Daniel Wong,Sylvia Strickland,rgregory@example.com,Type2,"Obrien, Hooper and Cunningham",40841468979,Platinum,Myself either crime know here international now.,Around give five see public into program.
0c46b1a8-2a4d-44cd-b6dc-0f2a30fb2f3a,Open,1977-10-06,1990-02-01,"White, Grant and Garcia",Yes,"['when', 'wear', 'decide']",13,6,3.452934780554594,Sarah Duncan,Marcus Jones,nmartin@example.net,Type1,Morales and Sons,32686943640,Platinum,Leave top cell business happy.,A near speech field area they attorney.
e8b90c18-1433-4a49-a7ec-918c6d300fed,Open,1998-12-23,2017-07-20,"Young, Jones and Martin",No,"['seat', 'push', 'discuss']",36,28,9.929041582026315,George Sutton,Christopher Taylor,farmerashley@example.net,Type1,"Johnson, Smith and Yates",81140912134,Platinum,Why begin few create herself talk next guy.,Economy public project leave poor get.
2922d4b0-b0ca-458e-8789-92e62bbc1626,Open,1947-10-29,1961-10-24,"Carter, Robinson and Mcfarland",Yes,"['suggest', 'whole', 'follow', 'degree', 'man']",5,23,7.24789768913191,Daniel Berry,Katherine Love,michellejohnston@example.org,Type3,"Patterson, Long and Clark",96361292613,Bronze,More price medical decision.,Present marriage explain will people difficult.
33c2aac3-195d-418b-9dbc-31d039dd163f,Pending,1995-03-23,2015-10-17,Gonzales PLC,Yes,"['do', 'generation', 'process']",50,5,5.759869194839686,Mallory Sloan,Jasmine Gilbert,jmoses@example.net,Type1,Conway and Sons,13831783621,Bronze,Door test room.,Here how idea view myself.
6ac53ffe-e655-4d30-895d-e409b18ee490,Closed,1980-06-07,2022-09-10,Hughes and Sons,No,"['great', 'amount', 'thousand']",1,7,6.533867372245155,Martin Oneill,Amber Richardson,shane31@example.com,Type2,"Lawson, Pratt and Jones",32605286699,Gold,Think agent project building third.,Special director large whatever school.
