SequentialId,Status,StorageDate,CloseDate,Team,Closed,Tags,QueueTime,FirstResponseTime,AverageResponseTime,CustomerName,AgentName,AgentEmail,Tipo,Empresa,Apolice,Plano,QUESTÃO 1,QUESTÃO 2
c3055135-df0e-401e-9d13-39067d08fb70,Open,1965-08-31,1991-06-02,Medina and Sons,No,"['order', 'class', 'will']",47,10,1.733264440488877,Samantha Moyer,Sarah Palmer,xcasey@example.com,Type1,Davis Ltd,8706482390,Silver,Mean eye up heart strategy yeah probably.,Someone anyone usually.
7921a0fc-3a94-4975-a082-7d016ccdacaa,Open,1998-08-02,1998-09-23,Henson PLC,Yes,"['significant', 'Democrat', 'lot', 'behind']",26,26,1.7001297239052962,Frederick Wolfe,Rachael Green,whitejohn@example.net,Type1,Jones-Roth,92819124874,Bronze,Cause serve girl.,Control yourself require executive source.
bda59d6c-e78b-42b2-baa1-260e7581bea5,Closed,1998-09-24,2017-02-07,Harris Group,Yes,"['expect', 'worry', 'already', 'less']",56,13,6.870485854608858,Matthew Bell,Victor Harrison,manderson@example.org,Type1,Whitney PLC,85967359439,Platinum,Free attention over.,Great article heart painting American break picture.
5574ca49-0fb3-4753-a976-1f895867678a,Open,1962-01-12,1962-07-03,Ford-Bush,No,"['traditional', 'middle']",31,7,1.1965847966356487,Corey Velasquez,Justin Wallace,valeriescott@example.com,Type3,Bowen-Davidson,21460332658,Gold,Wide know traditional pull where we.,Parent within build since.
f4bf1daf-dff1-4e14-aaac-1cf0ff9c36b1,Open,1956-03-27,1995-12-04,"Combs, Faulkner and Baker",No,"['then', 'ever']",39,6,1.8165621054272942,Cody Zhang,Joseph Padilla,medinarussell@example.org,Type3,Cain and Sons,83325913521,Gold,Hospital police health condition happen actually.,Involve before question true.
9a108d27-88ef-4f1b-93c9-e1b7d3990728,Pending,1978-09-15,1983-11-16,Meyer-Smith,No,"['report', 'cost', 'American']",8,7,2.283436120994502,Andrea Robinson MD,Lori Hayes,cwright@example.org,Type3,"Jenkins, Ramirez and Heath",60589342261,Bronze,Nation ever become require game involve could.,Teach beat condition never according task far.
efb55c19-9ffa-421f-9f32-62cf8ecf4d94,Closed,1956-05-04,1963-01-29,"Brown, Rojas and Anderson",No,"['pass', 'society', 'view']",14,18,9.844263875775502,Kristen Parker,Tiffany Rodgers,smithbrenda@example.org,Type3,Holmes Inc,43488032011,Silver,Role high early.,Project series suggest still son stand.
a98feb2f-4948-480d-b366-8741ae58b9a1,Pending,1997-03-27,2000-12-02,"Johnson, Taylor and Kerr",No,"['artist', 'report', 'majority']",17,7,8.269955417731596,Dr. Brandon Kim,Nicholas Dyer,ian42@example.net,Type2,Smith-Simpson,27368945699,Bronze,Cell value shoulder development.,Expect news though up.
a606afa3-3b3f-4f22-9bf7-b3e82cdf30ff,Pending,1961-02-22,1996-03-08,"Shepherd, Collins and Phillips",Yes,"['responsibility', 'both']",26,25,6.425085035076972,Gregory Castro,Timothy Jones,robertgarcia@example.org,Type2,Reynolds Group,28475120528,Platinum,Production wife require behavior force use.,Door only democratic range effect.
5e6539ee-d941-497a-a6d4-ac8bfee4f082,Pending,1990-03-14,1994-10-14,Gray-Schneider,No,"['able', 'guess', 'have']",12,23,3.764359650129165,Erin Harris,Matthew Williams,roberta00@example.net,Type3,Acosta-Marks,52255926079,Platinum,Step as watch but task unit oil positive.,Wind lose possible always international.
e5b711c8-95a7-4fc0-88d4-03267498a3ac,Closed,1965-10-21,1980-09-03,Pena PLC,Yes,['recently'],19,17,4.16523868849858,Colin Nielsen PhD,Cindy Mathis,richardstravis@example.com,Type2,"Stanley, Fischer and Chapman",99880983369,Bronze,Fire out material ahead.,Southern than world quickly popular society tell.
e99b6fa8-f71a-4c29-8d93-6be90ecbff3a,Open,1994-02-23,2002-12-07,Bell and Sons,No,"['thank', 'beautiful']",32,18,8.429023373610395,Rebecca Meyer,Kimberly Pace,obrienvictoria@example.net,Type1,"Warren, Sawyer and Gilbert",62863048922,Silver,Every term question up have whole.,Follow many Democrat for foot various.
5437a1a5-f743-438e-9355-07945b50b90c,Open,1953-11-03,1966-02-03,"Boyd, Bailey and Pittman",Yes,"['theory', 'here', 'eye']",59,11,9.068991929079594,Leslie Sanchez,Evan Garcia,trobles@example.com,Type2,Miller Group,39071666602,Silver,Figure value rise much.,Bar run mean watch American protect buy.
cbd56978-046e-475e-a2af-601dffacc4f2,Pending,1954-03-25,1978-11-25,Wilson-Wells,No,"['place', 'people', 'skin', 'hundred']",10,23,9.765047014332833,Vanessa Orr,Kimberly Ortiz,ljackson@example.net,Type3,Stuart-Santiago,52891184957,Platinum,Mother road what apply appear piece service cold.,Money arrive fire tend computer.
f3f9df97-b601-4fac-9d19-571b00ba67fe,Pending,1966-07-10,2000-11-19,White-Bradford,Yes,"['above', 'important', 'law']",3,29,8.68253325724027,Kyle Beck,Frederick Shea,jensenstephen@example.org,Type2,Gomez Ltd,46727763351,Silver,Fall both talk vote night himself able.,Candidate pattern range firm indeed.
2f251256-8887-480a-a78e-bfab308ed749,Open,1979-03-10,1990-03-11,Cruz-Gamble,Yes,['simple'],26,7,4.388837163768478,Dr. Brooke Soto,James Jensen,iwaller@example.com,Type1,"Rivers, Moon and Adams",20793599326,Platinum,Record color only theory like do.,Majority myself cost spend live military generation PM.
edb38d70-b0f8-4523-8859-37aa15f00d43,Closed,2002-12-08,2023-08-30,Cunningham-Johnson,Yes,"['technology', 'happy', 'law', 'address']",59,28,8.375987497542782,Jasmine Bates,Heather Chen,jaclynlopez@example.org,Type2,Barton Group,76369469001,Gold,Maybe herself while carry pretty eat.,Truth pass put owner.
6f8e6a68-9916-4a5d-8646-85ce966d8b6e,Closed,1980-06-28,2009-07-02,Hunter LLC,Yes,['oil'],30,22,8.579463069649659,Mrs. Danielle Livingston MD,Kelsey Wright,wmitchell@example.org,Type2,Brown LLC,81914856191,Silver,Step field thing day long item.,Card race she.
7f8332b8-474d-4d74-ae2f-9abe09e7a916,Pending,1989-05-21,1993-09-28,Cisneros-Garcia,Yes,['economic'],13,21,5.3213990980307075,Faith Rogers,Brett Carr,darren73@example.com,Type2,"Garcia, King and Lopez",96493154055,Silver,Personal many here operation I.,Source whatever job writer pick particularly position.
79c7e68c-03af-453d-a436-ce43c9b1f34f,Pending,2003-02-25,2022-05-22,"Gutierrez, Reese and Jenkins",Yes,"['institution', 'member', 'provide']",55,14,5.676204194110007,Kevin Dunn,Kimberly Rodriguez,tsimpson@example.org,Type1,Brown LLC,16190169025,Platinum,Court evening growth machine.,Half professional option officer family.
91bfb3c8-2ac6-4115-85b0-196eb96a73b9,Open,1958-01-21,2021-04-06,Simon PLC,No,"['baby', 'experience', 'what', 'direction', 'early']",46,21,6.1520144664949905,Elijah Walker,Emily Lopez,bradley03@example.com,Type1,Hickman Ltd,89128887183,Bronze,Ability like country because generation music.,By whose reach kid.
ef6e4ffa-aead-4e8d-82ea-3555efdf2698,Closed,1991-11-20,2017-02-11,"Shelton, Whitney and Gilbert",Yes,"['stuff', 'wait']",54,8,2.4357666842396943,Heather Taylor,Sheila Marsh,ysmith@example.com,Type3,"Powers, Strickland and Lawrence",3687784399,Gold,Whatever challenge them consumer including.,Federal occur high treat spend learn.
d17bb4f1-06c1-434e-98ca-bcc54a4695b4,Pending,1949-09-10,1960-05-27,"Stephens, Gonzalez and Jones",Yes,"['green', 'weight', 'current', 'such', 'you']",19,9,2.3577659082899065,Edgar Turner,Brian Christian,kathrynrodgers@example.org,Type2,Meza Ltd,26263716411,Bronze,Poor card attorney them.,Single big indicate specific six Mrs what put.
78ad7ad3-f26b-4837-b616-dee33b272c6a,Open,1979-09-12,1998-05-01,Norris-Parker,Yes,"['whatever', 'him', 'imagine', 'center']",54,29,7.5154937483871604,Tracy Rowe,Aaron Green,wattsraymond@example.net,Type3,Garcia LLC,89210074339,Silver,Personal forget conference common wonder she also drug.,Fill officer president present pretty opportunity really.
ceb0671b-7296-41af-aeeb-acce7513235e,Open,1963-12-30,2003-10-31,Wiggins-West,Yes,"['your', 'order', 'blue']",43,18,8.883376777289238,Rachel Holmes,Jeremy Bryant,leenatasha@example.net,Type2,Browning-Thompson,57384015819,Gold,Unit claim feel campaign sea.,Seven soldier difficult game next.
e3e3324f-c71e-4fe9-8a3c-bd450ac684bf,Closed,1985-03-04,2010-09-20,Wood PLC,No,"['big', 'father', 'opportunity', 'now']",43,18,7.923098635367159,Joan Williams,Jennifer Duncan,jenniferhanson@example.net,Type2,Grimes Inc,35456022869,Silver,Character agent woman level sound admit see significant.,Personal dream be carry last.
47acb349-c48c-43ea-bda8-fc37398cc03a,Closed,1958-10-07,2018-10-07,Cardenas Ltd,Yes,"['yet', 'summer', 'three']",30,30,4.230755775646693,Angela Franco,Dr. Mary Beard,henry87@example.com,Type2,Bauer-West,27506944409,Platinum,Big play part order into keep.,Summer agency car message election drive during.
075b250a-bb35-4a65-ad76-f96de6c27cbf,Pending,1953-08-22,1986-01-01,Roberts and Sons,Yes,['decide'],53,6,1.3687608301810597,Frank Ford,Stacey Johnson,robinsonnicole@example.org,Type3,Smith Group,68772309113,Bronze,Really easy beautiful authority back likely.,Such thus effort.
58e487f4-b232-4b03-83a0-903d7d7c7298,Closed,1990-08-27,1991-11-17,Jones-Mason,No,"['improve', 'they']",32,18,5.2877528033388455,Michael Campbell,Brendan Boyer,jacksonaustin@example.org,Type1,Wyatt Group,87737574822,Platinum,Throw concern computer.,Very gas hear rest action too blood.
1f3e5987-2b50-4ee7-b4ff-241e79d4a936,Closed,2003-10-18,2016-07-04,Stephens-Luna,No,"['they', 'record', 'manage']",17,6,3.6803918311202364,Danielle Leon,Robert Hensley,nespinoza@example.net,Type1,"Walker, Scott and Valenzuela",12884026293,Gold,Still fund full they central be pretty.,Environmental despite list sense visit rock.
b0fefa16-81e9-4cf0-b0ae-a1cd56a609bc,Open,1984-01-05,2000-11-29,Gilmore-Perry,Yes,"['senior', 'professor', 'office', 'view']",4,9,5.653303447615013,Teresa Hanson,Gary Sampson,carolreyes@example.net,Type2,Henson-Davis,63458889310,Platinum,System evening compare say message stay.,A necessary then training size.
a3fa5199-3b19-4e26-b4bc-08b409d951e0,Pending,1975-02-18,1994-12-24,Andersen-Moore,Yes,"['action', 'in', 'hot', 'use', 'win']",40,29,2.306144246082814,Ronald Allen,Lori Walsh,longchristopher@example.net,Type3,"Schultz, Ochoa and Bates",35944528263,Gold,Apply half minute read research.,Shoulder guess garden reality.
fa8a3388-2f5b-4ca7-9794-63dd41c12b5d,Closed,1979-11-15,1999-01-24,Richardson-Mckay,Yes,"['both', 'these']",28,29,6.434377854101191,Justin Hester,Travis Moore,xalvarez@example.org,Type2,Wilson Group,61895711020,Gold,Special Congress system tell.,Throughout PM about bit.
48c9fb95-8f19-49dc-b4b1-31575909f708,Open,1971-08-01,2014-04-22,Boyd-Gray,No,"['describe', 'anyone', 'fire', 'source']",21,18,6.10677682047232,Dylan Bass,Jessica Bruce,ngibbs@example.org,Type3,Baker-Jones,31581957232,Platinum,Long lay until family whose.,Everything easy person more before live.
e5b7de61-2e8f-44ef-a6fd-32a02cba8982,Closed,1957-03-12,1963-03-03,Edwards Group,No,"['enjoy', 'toward', 'crime', 'leg']",51,9,7.898799529039035,Richard Harris,Roberta Phillips,zhoward@example.com,Type2,"Wiley, Jackson and Clark",30043988318,Silver,Camera expert six cover field spring attention.,Cold along range early field across.
bfd8f1c4-9d74-402e-95a3-624388bbf366,Pending,1956-12-01,1967-02-04,Hunt PLC,Yes,"['role', 'drug', 'near', 'yes']",34,13,7.939020060795668,Robert Edwards,Gregory Lloyd,catherinethompson@example.org,Type2,Wilson-Carter,87046482154,Gold,Food win quite party allow fear doctor.,Boy information those discussion role.
5a2e02fe-ac82-40b3-9803-cfbcbf53836b,Open,1997-02-03,2020-07-05,Kennedy Inc,No,['between'],12,21,9.983864459962712,Jerome Rowland,Samantha Lee,kyleryan@example.org,Type1,"Williams, Johnson and Moore",68762268925,Bronze,Head grow help small program.,Mother rather future.
8e7dc771-0a19-47c9-b7e3-e762768c4b46,Closed,1992-12-03,2003-01-21,Calderon-Dunn,Yes,['manage'],53,24,8.49180337188347,Julie Martin,Angela Roberts,kennethjones@example.net,Type3,Jones LLC,2338684669,Platinum,Police analysis recently other begin TV parent.,Wait one memory others opportunity represent budget admit.
fd4df420-be66-4638-bf84-8acf742ea1b5,Closed,1950-04-11,1956-11-25,Griffith PLC,No,"['career', 'laugh']",12,5,4.861624863724821,Jason Gill,Shannon Rice,christophermcdonald@example.org,Type2,Sanchez LLC,76099448642,Gold,Low as face professional red.,Business election particular enough I less still.
bcf4621d-b28c-4420-b9ff-713a5463cab9,Open,1969-09-04,1989-07-14,Wells Group,Yes,"['five', 'build', 'focus', 'television']",35,26,4.105036221382533,David Oneal,Joseph King,antoniojones@example.org,Type2,Bailey-Perry,40540845616,Silver,Billion place animal huge particular manager sometimes morning.,Too trip production item end form.
5e80ef62-54e3-4ec8-8355-5592fce3c986,Open,1962-03-24,2000-06-18,"Simmons, Johnson and Livingston",No,"['marriage', 'can', 'high', 'head']",47,10,1.8667293956653364,Tyler Mccoy,William Poole,ebarnes@example.org,Type3,"Martinez, Donovan and Parker",68447715796,Bronze,Adult yeah body you for professional.,Anyone check contain throughout cost.
baf502ef-d2ca-454e-b906-9d46c90a0be9,Closed,1990-06-04,2004-11-29,"Lynn, Williams and Flynn",Yes,"['approach', 'citizen', 'low', 'type', 'argue']",51,29,5.6795397981768865,Megan Young,Jenna Johnson,gsmith@example.org,Type3,Ryan PLC,15831880135,Bronze,Measure per pay key.,Pretty note above total.
5dd87bb9-422b-4816-a5e3-e60400c5e52c,Pending,2002-05-31,2016-10-31,"Miller, Foley and Hamilton",Yes,['floor'],32,27,4.365391615009453,Sara Thomas,Diana Hodge,apark@example.com,Type2,"Obrien, Morrison and Garcia",36333117448,Bronze,Will personal move.,Job usually inside oil enough network.
199e62e1-d8cc-47d5-acf0-f6fce0f9386c,Pending,1998-01-02,2003-06-26,Perry-Chen,Yes,['else'],56,15,8.892752107862668,Ryan Johnson,Rachel King,turnerdaniel@example.com,Type2,"Conner, Vaughn and Haney",4594452124,Bronze,Bad give interview they.,East which position more executive community collection.
9034f93e-21b9-4b6a-ab7a-528d5848720d,Pending,1959-12-07,1966-11-23,"Morgan, Mccoy and Higgins",Yes,['week'],33,20,2.088654943851386,Ebony Rhodes,Ashley Wall,pamela09@example.org,Type1,Lopez-Erickson,23102208423,Gold,Human future party matter between surface.,Control to early exactly or door likely.
9752b3df-e47e-4b65-ad3b-795c3ff21837,Open,2001-05-13,2003-03-19,Barnett and Sons,Yes,['whole'],32,19,6.557927883745618,Anthony Cross,Howard Pham,carmen12@example.net,Type3,Andrews Ltd,86013733871,Bronze,Sport purpose later strategy him message.,Information north special model laugh.
af707eec-7f0f-4173-a6e5-f7fc8fc84459,Closed,1970-04-19,2007-09-03,Bryant-Clarke,Yes,"['discover', 'determine', 'meet', 'east']",40,30,8.453280958893084,Stephanie Davis,Nancy Fritz,brandonowens@example.com,Type2,"Roberts, Scott and Bass",87711496090,Gold,Degree after feel decision reflect century positive.,General environment bit note leg.
b91b60ff-fe1f-4105-be8b-0e86e1792689,Open,1971-01-19,1981-11-15,Smith and Sons,Yes,"['much', 'discover', 'improve', 'between']",45,22,1.3843425107156553,Zachary Page,Erin Maxwell,znorris@example.com,Type3,Rose Inc,10284014711,Silver,Professional task half maintain.,Girl three travel year phone wall.
a9aa7a59-1495-4c57-b50d-12b9328461a9,Closed,1977-03-31,2016-10-18,Ramos-Warner,No,"['right', 'single', 'try']",39,25,6.533961383512819,Andrea Rodriguez,Ryan Barrera,grossearl@example.org,Type3,"Davis, Sweeney and Davenport",361222735,Platinum,Raise explain risk loss American ten.,Together still large fire.
9fdc2922-6706-4f03-857a-d697fbc04f44,Pending,1993-10-29,2000-02-20,Hoffman Ltd,No,"['beat', 'prepare']",43,11,8.05782534220262,Cameron Cardenas,Brian Salazar,agriffin@example.net,Type1,"Trujillo, Knight and Dawson",64864266208,Silver,Special type yourself nature.,Much reduce meeting both color.
8607d770-d303-4659-9fa3-1435e0362c6b,Open,1987-08-17,2018-07-04,Nelson-Brown,No,"['surface', 'letter', 'film', 'day']",19,20,8.275453589521348,Bryan Blackwell,Brian Duran,carolineanderson@example.net,Type1,Bentley-Garrett,98992808683,Bronze,Value let individual effort.,Hit under guess early maintain stand.
77b60e9a-2a89-49f6-9352-c4a8e86c15f7,Pending,1965-05-30,1999-04-22,Kim and Sons,No,"['project', 'field']",19,17,9.721718546488596,Eugene Smith,Tristan Navarro,joshua33@example.org,Type3,Hall-Ruiz,41848275602,Platinum,Pass sense player.,Drop image something southern require medical book.
84d724fe-7d20-493a-966e-6f1eff574a60,Closed,1971-02-20,1995-11-10,Wilson Group,No,"['whose', 'that', 'get']",19,14,9.40683297959458,Robyn Black,Wendy Wong,pattersondylan@example.com,Type3,Alexander-Mcguire,67414133335,Platinum,Present authority onto order government forward senior.,Others as course personal data appear skin future.
5625d77f-696e-4ef0-b712-54836e1d3e82,Pending,1963-02-07,2002-07-27,"Davis, Mendoza and Lewis",Yes,['grow'],55,29,8.920873406048084,Jill Johnson,Thomas Hernandez,ryancasey@example.org,Type3,"Johnson, Young and Bryant",47417716279,Silver,Reality south list accept trial.,Star eat remember what feel.
515c3914-e0f8-4435-a6d9-32d926c9df4f,Pending,1983-07-17,1990-06-08,Flores-Young,No,"['letter', 'live', 'treatment']",41,6,4.083050448931356,Richard Jackson,David Palmer,maryroberts@example.org,Type1,"Williams, Douglas and Jones",72382657968,Bronze,Congress water boy mention short fine card.,Whole quickly million office along pressure hope.
a8c7c1de-84aa-4009-b50a-1ecb0204ecfe,Closed,1985-01-11,2005-02-01,"Clark, Hamilton and Hodges",Yes,"['serious', 'news', 'yard', 'drug']",37,7,4.301947070089831,John Young,Juan Rodriguez,wjones@example.com,Type3,Wiggins-Smith,87802250931,Gold,Garden team film than much.,Wonder behind example image at almost.
31b6cd06-3a75-4475-b1c5-cd045dbcd317,Closed,1959-04-12,1960-11-29,Adams-Lee,Yes,"['indeed', 'picture', 'it', 'both']",3,18,1.260051824301382,Kimberly Wall,Nicole Garcia,shirleyrobinson@example.net,Type1,"Jensen, Henry and Smith",33105017894,Gold,Material reality realize item know.,Source test woman.
6e0676df-021a-4a7c-8d9f-a4aee6cc4161,Pending,1964-03-10,1989-09-19,Park and Sons,Yes,"['north', 'admit', 'cause']",16,13,2.327093396765538,Kaitlin Dalton,Aaron Whitaker,agreen@example.net,Type3,Allison-Sullivan,56945297065,Bronze,Product foot school along research effect Republican.,I sign have whose my police can white.
f0c967be-9f18-4c74-b50d-63728f803d53,Closed,1955-07-13,2000-02-14,"Smith, Chan and Johnston",Yes,"['speak', 'bar']",27,5,9.994541805519296,Ricky Strickland,John Hernandez,thutchinson@example.org,Type2,Bell Ltd,94701333898,Silver,Risk another market forget do free.,Speech him identify less onto lawyer marriage.
a0666e8d-386f-423b-a9f1-5aa9efa396e0,Closed,1968-08-29,1989-07-08,"Schwartz, Carney and Clark",No,"['describe', 'foreign', 'he']",18,26,6.788649500624437,Allison Anderson,Brandon Mason,dhernandez@example.org,Type2,"Wall, Smith and Williams",1585011592,Gold,Material act level education skin more.,Six reflect wife reflect big.
ae7b5350-287f-4c16-9548-cd09b473b43a,Open,1997-07-04,1998-11-11,Allen PLC,No,"['indicate', 'ball', 'bed']",42,6,6.94143765241523,Kristy Green,Christopher Smith,crossgeorge@example.org,Type3,"Williams, George and Spencer",60242995960,Bronze,Majority look effort leg two current accept station.,Support production condition also.
f1dc5f20-7ed5-48e7-90f2-48f2766a677a,Pending,1975-03-10,2019-12-27,Morton-Ray,No,"['question', 'single', 'consider']",24,18,9.631042499742787,Danielle Peters,Steven Walker,uhumphrey@example.com,Type1,Avery-Potter,26834935312,Platinum,Another type future effort accept example more.,Phone bad group role with nothing likely.
2d712ea6-e165-4f65-a8f7-855cf5caea5d,Open,1969-01-29,1998-07-28,Knox PLC,No,"['follow', 'attack']",6,23,9.677227393158057,Sonya Green MD,Kathryn Irwin,coryramos@example.net,Type1,"Reyes, Miller and Simmons",64459243951,Bronze,Nation choose feel modern hundred may.,Including president add provide cover black.
e0f65694-b28d-4f7a-b44d-a0c18ea9bada,Closed,2003-09-29,2023-08-28,Hunt-Khan,No,"['federal', 'eight', 'set', 'Democrat']",38,26,5.85164614444901,Matthew Spencer,Cassandra Murray,jacobgilbert@example.org,Type1,"Allen, Jordan and Lozano",40650127010,Platinum,Figure ten owner might.,Cup drop agency find.
64329bb6-66b4-4d04-aeda-c654fe99923e,Closed,1958-03-28,1993-09-09,Duarte-Gonzalez,Yes,"['usually', 'quality', 'interesting', 'similar', 'and']",24,25,9.960562762455796,Jennifer Campbell,Jay Wallace,henry98@example.com,Type2,Freeman-Jenkins,88294827981,Bronze,Walk your ever friend party.,Wife democratic scientist professional know.
f735aaf8-72c0-4b5c-807a-72f9958cc0a4,Pending,1993-02-04,2018-09-21,Watson-Smith,Yes,"['he', 'look', 'member', 'far']",45,26,7.727002491260662,Rachel Beck,Jennifer Sherman,martin46@example.com,Type3,Woods-Hernandez,51042828486,Platinum,Music style nothing continue.,Line our later voice me pay now decade.
4e5588bf-8dfb-4248-a190-a80d323d346c,Closed,1964-11-13,1997-06-18,Allen Ltd,No,"['forward', 'nation']",25,8,5.529703810737695,Matthew Knapp,Charlotte Holden,obrown@example.com,Type1,Ryan-Wong,41098064777,Silver,Religious trouble newspaper test still.,Ahead civil walk high particularly nothing wind sure.
89986ded-2113-4730-a599-03e5f71fa977,Open,1973-04-28,1973-06-08,Malone-Navarro,No,"['last', 'strong', 'perform']",24,14,8.12583420770425,Ms. Christine Espinoza,Brenda Wagner,yphillips@example.com,Type1,"Pennington, Love and Castaneda",29428953317,Platinum,Its fish people feeling again good.,Build much probably toward.
22a35285-449c-4591-ab96-7152f73800a3,Open,1966-04-18,1995-08-10,Cruz-Brown,No,"['edge', 'develop', 'fine', 'turn', 'few']",33,24,5.031825000176799,Robert Cain,Patricia Perry,pereztina@example.net,Type3,Jones-Myers,32457980836,Gold,Own including reflect feeling.,Natural start last want southern fill see yourself.
68ee029c-13dd-4f6d-83bb-11af71280068,Pending,1989-06-26,1997-06-09,Peterson-Green,No,"['chance', 'generation', 'middle']",60,28,8.541216061183706,Stephanie Gonzalez,Allison Dawson,barbara82@example.net,Type3,Phillips Ltd,25856308404,Platinum,Notice listen behind wonder better worker medical.,Space realize evening yes.
41cbc3ca-b630-4512-948b-b53548375ab3,Pending,1953-05-04,1999-07-17,Martin LLC,No,"['available', 'the', 'leader', 'purpose']",8,30,1.7186932359942397,Mason Moore,Tina Walls,timothy70@example.com,Type1,Stewart Group,84348673127,Silver,Spend event must than huge budget leg.,This act page sit.
2d11fdf7-76fe-4768-8ee5-9ee2fd9f3db4,Pending,1953-12-30,2001-05-28,Farmer PLC,Yes,"['thousand', 'contain', 'against', 'put']",30,13,8.113978706464001,Charles Lopez,Jared Miller,bmiranda@example.net,Type3,"Matthews, Jackson and Murphy",65335045062,Bronze,Series as religious.,All team prove.
c5cd8a96-91b5-4b5d-ba9c-9d35252b47ac,Open,1999-01-27,2021-02-10,Brady and Sons,Yes,"['day', 'food', 'rich']",5,30,6.4422398619504815,Daniel Hanson,Nicole Wilson,xgonzalez@example.com,Type3,Potts-Trujillo,29475929454,Bronze,Number show order sing.,These appear area.
bd8cf0b1-8d36-4283-9b7e-10b9fb5b2018,Pending,1952-05-02,1964-01-30,Cochran-Richard,No,"['think', 'yourself']",34,7,8.737040657827478,Elizabeth Robbins,Brian Ferguson,uarmstrong@example.org,Type3,Flores LLC,2017976811,Platinum,Low staff bad few wife.,If field music here smile career music or.
ad695022-0649-466d-b99d-4d5f5ec7b89e,Pending,2004-06-27,2014-05-28,Larson LLC,Yes,"['degree', 'source', 'pay', 'television']",59,19,9.911012932649163,David Campbell,Peter Spencer,richard32@example.org,Type3,Grant-Carter,23004719356,Platinum,Theory these friend moment later or.,Benefit police law front.
589807f9-a1de-4e65-b6ea-feea6077a18a,Open,1973-12-12,1983-12-07,"Munoz, Lane and Barker",Yes,"['race', 'effect', 'play', 'that']",8,26,7.964900398321057,David Rivas,Ashlee Jones,brandon88@example.org,Type1,"Jackson, Crane and Robinson",34802331276,Silver,Eye tend body challenge owner cost throughout.,Maintain scientist product million sister.
9e7a1bc8-3888-4f83-968c-d13487dfedbb,Pending,1992-01-14,2006-09-17,Davis-Terry,No,"['process', 'major', 'TV', 'suggest']",43,17,7.144112079671739,Sharon Hall,Marissa Shaffer,troyzimmerman@example.net,Type2,"George, Armstrong and Huang",58036928766,Gold,Test result rule true everybody.,News seem paper out three.
6f9584f9-ceef-4640-beb7-a838266b65fe,Open,1995-06-16,2011-07-08,Powell-Wilson,No,"['write', 'wonder', 'financial', 'adult']",35,14,2.516529762791598,Jennifer Johnson,Mitchell Guerrero,nweeks@example.net,Type2,Hanson-Douglas,96127828554,Gold,Environmental firm mother theory everyone leg.,Issue suddenly perhaps stand thus world.
732bc443-f79b-480d-aa12-aff656e8aa2f,Open,1985-03-22,2018-02-06,Allen Group,No,"['smile', 'decide', 'adult', 'bring']",14,30,2.3529320366707713,Ariana Morris,Tammie Campos,ebryant@example.com,Type2,"Adams, Ray and Brown",967608356,Platinum,Bill perform ever other your charge we benefit.,Hand education put three.
b2eb4c33-c51e-4bd3-8e8b-98eb52f6312e,Open,1985-10-07,1994-12-18,Frank-Randall,Yes,"['newspaper', 'pass', 'doctor', 'within']",17,19,7.161989433947085,Cynthia Kim,Jamie Warren,michelle27@example.com,Type2,Sanchez Group,12832557240,Platinum,Response only improve also.,Wife maintain beyond training entire agency give.
7c5ab586-6125-4294-b5d2-1168ee361da9,Pending,1998-07-21,2007-06-04,Reilly Inc,Yes,['product'],37,22,4.971662475038393,Mary Griffin,Larry Roberts,welchbethany@example.org,Type1,Mcneil-Arnold,8757572824,Silver,Effect center special skin camera exactly market.,Century owner might protect.
ae83b44b-4bc9-4942-ac47-d07cb072bd92,Closed,1967-01-20,2011-09-03,Compton PLC,Yes,"['art', 'score']",39,8,6.996881939238339,Kimberly Malone,Catherine Walters,brian70@example.org,Type2,Beck-Rivera,2249767885,Gold,Agreement nation anyone bed magazine floor mean.,Raise role board your field minute machine.
1e285d03-d6b3-49a4-9685-31f191397359,Closed,1983-10-13,2019-08-05,Gilbert Ltd,No,"['them', 'share']",20,18,7.174108642729649,Brian Cruz,Amber Anderson,pooleshannon@example.com,Type1,Maxwell-Estrada,41591677732,Gold,Process middle positive special test region at.,Throw step off really no Mr doctor course.
